Tweet,Previsão
 Rodrygo Foden thinks hes the British Messi laughs  ,Positivo
my club still employs phil foden  ,Negativo
  Since Pep Joined  ,Positivo
Foden vs Real Madrid  Highlights Le diamant de city  ,Positivo
So were like just not going to speak on that Fodens performance Nah Cool,Positivo
wE lsT bUt FoDeN sCrEd hIs pEn  ,Negativo
I posted this on IG expecting Foden to thump one top bins   ,Positivo
Your City side to face Real Madrid XI  Ederson Walker C Akanji Dias Gvardiol Rodrigo De Bruyne Bernardo Foden Grealish HaalandSUBS  Ortega Moreno Carson Stones Ake Kovacic Doku Alvarez Gomez Nunes Bobb Lewis ManCity   UCL  ,Positivo
I dont think this was anywhere near a great performance from Foden especially because of his missed chance in the box In total Id give him a  I did have some takeaways regarding his positioning and the discourse around that  ,Negativo
Foden stinker when the lights were on him   ,Positivo
Real Madrid knocks out Man City in the shootout  ChampionsLeague  UCL  Rdiger  ManchesterCityRealMadrid  Foden  DeBruyne  Rodrygo  Bellingham  HalaMadrid  QuarterFinals  Kroos  MCIRMA  ManCity  RealMadrid  ,Positivo
We started an actual lb and for  minutes of football none of the City players dribbled past him He locked Bernardo and Foden Ferland Mendy  ,Negativo
Been hearing Saka this  foden that we all know the original Starboy ,Positivo
Odegard who Foden who Declan who,Positivo
Also need to figure out what to do with Foden Second best player this season still getting thrown around every position,Negativo
Not even tryna ride out for Foden but  times out of  the reason he plays poor in big games is cause Pep forces him into the touchline so KDB can play in his natural position Hes an interior not a winger,Negativo
thank fuck foden didnt miss that pen im kinda disappointed in hin though he has to start getting on the ball more youre a superstar act like it,Negativo
Thought the same It felt really good Karma is foden   ,Positivo
Against the odds Were Real Madrid  ,Positivo
Pep Guardiola after Man Citys defeat to Real MadridWhat a hell of a way to lose Johan Cruyff said that luck doesnt exist and I agree  ,Negativo
 Jude Bellingham shows Real Madrid logo after scoring the penalty  ,Positivo
Real Madrid saved football  ,Positivo
Real Madrid have never beaten City at EtihadAnd then comes Carlo Ancelotti ,Positivo
THIS IS REAL MADRID  We always fight  we always believe  we never give up HALAAAA MADRID   MCIRMA  UEFAChampionsLeague  MadridDay  ,Positivo
OFFICIAL Arsenal are out of the Clubs World Cup after tonight RB Salzburg access to the World Cup Manchester City Chelsea Real Madrid Atltico Madrid Bayern Borussia Dortmund Paris SaintGermain Inter Juventus Benfica Porto Salzburg  ,Positivo
Man City fans have a message for Real Madrid   ,Positivo
Real Madrid go to the Etihad and knock the European Champions out of the UCL   ,Negativo
THIS IS REAL MADRID  We always fight  we always believe  we never give up HALAAAA MADRID    UCL  Hustle  AlwaysBelieve  ,Positivo
ANDRIY LUNIN YOU ARE A REAL MADRID LEGEND THANK YOU  ,Positivo
ESPECIALLY FOR THE NEWCOMERS THIS IS REAL MADRID WE NEVER GIVE UP,Positivo
Real Madrid vs Manchester City in a nutshell  ,Positivo
Jude Bellingham and Real Madrid on the cover of     ,Positivo
Real Madrid qualified to Champions League semi finalsManchester City eliminated   ,Positivo
After Speed celebrated Rodrygos goal in the Man City vs Real Madrid game Man City fans got mad at him and told him to end his stream   ,Positivo
 Real Madrid confirm that Dani Carvajal and Vinicius Jr are not injured nothing serious for both of them  ,Negativo
Antonio Rdiger Kept Haaland scoreless over two legs and converted the penalty to send Real Madrid into the semifinals   ,Positivo
HALA MADRID Another nailbiter another victory This teams heart is unmatched  LeyendaContina  RealMadrid HalaMadrid  RealMadridManchesterCity  ,Positivo
Heat  ManchesterCityRealMadrid  ChampionLeague   RealMadrid  ,Negativo
Antonio Rdiger scores and Real Madrid is in the Champions League semifinal In the face of the dirty smear campaign against him because of his Islamic beliefswe repeat his wordsAllahu Akbar ChampionLeague   RealMadrid  ,Positivo
JUDE VICTOR BELLINGHAM  RealMadrid   ChampionsLeague  ,Positivo
Vinicius and Rodrigo are crazy   HalaMadridYNadaMas  RealMadrid  ,Positivo
Replay of Bernardo silvas penalty v Real Madrid RealMadridManchesterCity  HalaMadrid  realmadrid  ,Positivo
Fede Valverde the Most underrated players in the world  HalaMadrid  RealMadrid  ,Positivo
Give your opponent hope to live and then kill himThe wise Ancelotti RealMadrid  ,Positivo
Lodging       RealMadridManchesterCity  RealMadrid  realcity  ,Positivo
Only team to go down in history to win back to back UCL trophies in the Champions League era  Real MadridThere is no other team SUPER TEAM MIRACLE CLUB RealMadrid  ,Positivo
Pure teamwork by the Real Madrid goalies   UCL  ChampionsLeague  RealMadrid  ManCity  ,Positivo
enfin les bookmakers respectent le  RealMadrid   ,Negativo
Los Blancos warmups   LaLiga  RealMadrid  ,Positivo
Lunin deserves every bit of the praiseBlud was backup goalkeeper since  But never gave up And his efforts have reaped fruits now and howTake a bow Lunin  RealMadrid  ,Positivo
 semis in the last  seasons only team to defend the title in the Champions League era  trophies in the CL era  times champions of Europe in total Truly the kings of Europe Real Madrid HalaMadrid  RealMadrid  ,Positivo
Real Madrid fans right now RealMadrid  ,Positivo
Kepa played his part tooAdvicing lunin about Man City players ChampionLeague  RealMadridManchesterCity  Lunin  HalaMadrid  RealMadrid  ,Positivo
Real Madrid are the aristocrats of European football UCL  RealMadrid  RealMadridManchesterCity  ,Positivo
Real Madrid knocks out Manchester City More pain for Barcelona  ,Negativo
Warra Win that is for Manchester City  ,Positivo
Back to back joysKill meKilled KINE LAKERS MADE PLAYOFFSMANCHESTER CITY GOT ELIMINATED BY REAL MADRIDMe rn  ,Positivo
OFFICIAL Arsenal are out of the Clubs World Cup after tonight RB Salzburg access to the World Cup Manchester City Chelsea Real Madrid Atltico Madrid Bayern Borussia Dortmund Paris SaintGermain Inter Juventus Benfica Porto Salzburg  ,Positivo
Thank you Real Madrid for humbling Manchester cityWe remain Brothers   ,Positivo
Real Madrid vs Manchester City in a nutshell  ,Positivo
Liverpool  European Trophies Manchester City  European Trophies Arsenal  European Trophies If your gonna try take the Mick out us the worst thing you could do is use Europe   ,Negativo
Manchester City and Arsenal are out of the champions league They are taking all that anger to their next games which are both against Chelsea God will stand for us  ,Positivo
Lucas Vasquez Manchester City City at home has a very particular game They are a great team and have a great game but in our heads we knew that we were going to have our options on the counterattack We got ahead in a great collective play and then we knew how to sufferThey are the current champion one of the big favorites and we have eliminated them We are two games away from a final and we are going to go to the death,Positivo
Real Madrid qualified to Champions League semi finalsManchester City eliminated   ,Positivo
 HalaMadrid  HalaMadridYNadaMasReal Madrid have never beaten Manchester City at Etihadand thats where Carletto comes in  ,Positivo
Lunin vs Manchester City  ,Positivo
Manchester City about to take all their anger out on Chelsea this Saturday  ,Positivo
Les Notes Manchester City Real MadridBayern Munich Arsenal  ,Positivo
How does it feel to be a Manchester City fan  ,Positivo
The Fathers of Manchester City and Liverpool  ,Negativo
Arsenal and Manchester City fans ChampionsLeague  BAYARSAfter the first leg     and     After the second leg  ,Positivo
Test the waters Manchester City  ,Positivo
In it together  ManCity  ,Positivo
it is more blessed to give than to receive  bibletruth  bibleverseoftheday  scripture  bible  biblebuild  AskMikha  BAYARS    deprem  ImpossiblePM  ManCity  ,Positivo
BIG  UCL night loading  ManCity  ,Positivo
I bless you my children   chantoken  ManCity  ,Positivo
We were better and we played better but they were lucky winning on penaltiesThe true champions  ManCity  ,Positivo
 ManCity Real Madrid to Man city  ,Positivo
EVERYWHERE HE GOES Dubai  ManCity  Trump   ,Negativo
I think I speak for  ManCity fans everywhere when I say  ,Positivo
Lunin Appreciation tweet like and retweet if you believe this guy saved us all today  HALAMADRID  ManCity Madrid  ,Positivo
HALFTIME  Behind at the break     ManCity   UCL  ,Negativo
FULLTIME  Extra time is needed     ManCity   UCL  ,Positivo
Good morning world Todays agenda ignite passions chase dreams and conquer the day like never before Lets turn up the energy seize every opportunity and make waves that rock the universe  GoodMorning  ManchesterCityRealMadrid  ManCity  ,Positivo
City fans rejoice  ChampionsLeague  RealMadrid  ManCity   ,Positivo
EXTRATIME FULLTIME  Penalties will decide the tie     ManCity   UCL  ,Positivo
Herrrhhh Manchester City MCIRMD  ManchesterCityRealMadrid  ManCity  ,Positivo
Pep Guardiola to Sheikh Mansour I need m to buy penalty takers in the summer  UCL   MCIRMA   Mancity  ,Negativo
Meet Fernando   s bus driver for the last  years Hes been to more UEFA Champions League Finals than  PSG  Barcelona  Chelsea  ManCity amp  Liverpool   ,Negativo
Lets connect MadridstasDrop your handles and Repost  RealMadridManchesterCity UCL  HalaMadrid  MCIRMA  ManCityVinicius Rudiger Hala Madrid Man City De Bruyne Haaland Bellingham Real Madrid Lunin Rodrygo  ,Positivo
 Real Madrid win Barca loss Atleti loss Al Hilal loss Mbappe masterclass Araujo red Ronaldo has the most insta followers  Messi ghosted Haaland ghosted Neymar has only one legI LOVE GOD   ,Negativo
We need to SPEAK about Erling Braut Haaland  ,Positivo
I HOPE WE ALL AGREE NOW THAT RDIGER POCKETED HAALAND HOME AND AWAY  ,Negativo
Haaland giving up on his dream to be the face of a generation at   ,Positivo
Antonio Rdiger Kept Haaland scoreless over two legs and converted the penalty to send Real Madrid into the semifinals   ,Positivo
Jude Bellingham and Erling Haaland are not big game playersGoodnight  ,Positivo
They dont realise Pep is using Haaland as a pawn to keep the CBs occupied Literally all our goals against Madrid at the Bernabeu have been outside the box including the De Bruyne goal last season ,Negativo
Julin lvarez who completed football at  years old almost singlehandedly won Man City FIFA club World Cup but Pep chose to play  against Real Madrid and put Haaland as the main striker I will never understand  ,Positivo
Im so sorry to comparing Mbappe to haalandMbappe is clear of HaalandPls forgive me  ,Negativo
Best player in the world vs Haaland the tap in ghost  ,Positivo
Everyone talking about that Haaland performance but what about judas bellingbum the ballon dor front runner  with  terrible performances over both legs  ,Negativo
Erling Haaland can never ever be the best footballer in the world You are literally disagreeing with your eyes and the entire history of the sport if you think otherwise  ,Negativo
Your City side to face Real Madrid XI  Ederson Walker C Akanji Dias Gvardiol Rodrigo De Bruyne Bernardo Foden Grealish HaalandSUBS  Ortega Moreno Carson Stones Ake Kovacic Doku Alvarez Gomez Nunes Bobb Lewis ManCity   UCL  ,Positivo
Made Haaland his dog for both games and then scored the winning penalty to knock Man City outAntonio Rudiger Appreciation tweet  ,Positivo
Erling Haaland in the st leg vs Real Madrid  minutes played  goals  assists  shot on targetErling Haaland in the nd leg vs Real Madrid  minutes played  goals  assists  shot on target  ,Negativo
Sometimes Caregivers are so focused on their patients that they forget to care for themselvesIt is important to watch out for these signs of Caregiver stressPortable  Lawrence Oyor  Guinness World Record  Rice  Resign  Korra  Ododo  Haaland  ovalcareng  adminhire  ,Positivo
 Pep Guardiola Haaland De Bruyne and Akanji asked me to sub them out They couldnt continue,Negativo
Puskas at  is a better dribbler than Haaland,Positivo
HELPPPPP pep side eyed him and rodrygo said he gave me the stare   ,Positivo
Rodrygo against Man City  ,Positivo
Pep Guardiola passed by rodrygo and looked at him during the interview AND HIS REACTION LMAOOO  ,Negativo
rodrygo looks tiny in that massive jacket   ,Positivo
 Rodrygo Foden thinks hes the British Messi laughs  ,Positivo
Rodrygo needs  more goals to overtake Suarezs goal tally in the ucl  ,Positivo
Rodrygo whenever he plays against City ,Positivo
In all honesty I think Rodrygo Goes will go down as a champions league monument The guy is known by the competition Hes been one of the best performers in the competition in the last three years but hes least talked about  ,Negativo
Real Madrid have never beaten City at Etihad  And then comes Rodrygo No Real Madrid fan will Pass without likingHala Madrid  HalaMadrid  ReadingFC  ManchesterCityRealMadrid  ,Negativo
Rodrygos goal is the difference  Agg   UCL  ,Positivo
Rodrygo strikes first  UCL  ,Positivo
Pep whenever he sees rodrygo  ,Positivo
After Speed celebrated Rodrygos goal in the Man City vs Real Madrid game Man City fans got mad at him and told him to end his stream   ,Positivo
 BUUUUUUUUUTT DE RODRYGO  MAN CITY      REAL MADRID  ,Positivo
 k  Wallpapers    Real Madrid      Rodrygo  ,Positivo
After Speeds enthusiastic celebration of Rodrygos goal in the Man City vs Real Madrid game irked Man City fans they demanded that he end his stream in annoyance  ManCity  RealMadrid  ,Positivo
 Rodrygo scores his th Champions League goal of the season  goals in all competitionsOn fire   ,Positivo
Rodrygos reaction after he saw Pep  ,Positivo
Vini Jr to Jude Bellingham on IG I told you this is Real Madrid   ,Positivo
Jude Bellingham amp Vini Jr   HalaMadrid  UCL  ,Positivo
Congratulations all fans real madrid           happy day  ,Positivo
Guardiola stayed up for nights to prepare for this game and Real Madrids franchise player Vini Jr started doing snake disses aka the Nagin move to his players This is the singular level of shithousery why I love this game  ,Positivo
 Vini Jr to Jude Bellingham on IG I told you this is Real Madrid  ,Positivo
Second leg against Bayern is at Bernabu oh baby  ,Positivo
 Vini Jr to Rodrygo Mr Champions League  ,Positivo
 Vini Jr to Rodrygo Mr Champions League  ,Positivo
Well Vini Jr got clamped by Walkerno shots But you know who showed upThese boys  Cord was jumping this afternoon  EUROS THIS SUMMER Link below Tap in    ,Positivo
Im in love but with club but more yes more than u can think than u can imagine yes there is a club u knw who are they they are   My god I LOVE U ALL                  ,Positivo
  MY REAL MADRID   ,Positivo
 Vini Jr to Rodrygo Mr Champions League  ,Positivo
This picture is too cold,Negativo
   asked the club about the health of Vini Jr and Dani Carvajal The club replied They are dancing in the locker room with the music super loud  ,Positivo
Power of friendship,Positivo
CRACK,Positivo
  The Cobra styleVini Jr  ,Positivo
  lol idk if u can really do the push the vini jr amd bellingham for balon dor agendapart biggest game of the szn and this is the magic they produced as the cf and strikerforget not scoring thats minor but zero shotsSTOP IT  ,Negativo
Every Time we wake up We Pray to God Look at this Numbers and say  Alhamdulillah Were not sleeping this summer Training till we get it   Champions  ,Positivo
No true Madrid fans will scroll pass without dropping a ANDRIY LUNIN ChampionLeague  Champions  UCL  ,Negativo
Real Madrid thats the tweetLike this tweet if u are happy Madrid wonl MCIRMD  ChampionsLeague  Champions  HalaMadrid  citizens  ,Positivo
Hehehe siuuuu  Lets laugh at these small teams getting out   ChampionLeague  Champions  ,Positivo
Before the  exodus swimming drill  swimming  swimmers  kids  Israel  training  athletes  champions  team  ,Positivo
Got this beaut of   last night  Pompey  Champions  ,Negativo
Manchester City are out  what a day  Real madrid hala madrid to semi final  ManCity  ChampionLeague  Champions  ,Positivo
Well last night escalated quickly PUP   Pompey  Champions  Southsea  Bishop  Lowery  ,Negativo
I am a  Goddes  Shes Here   h  Building   Tinkerbell  Timber Land  Chosen One   Champions  Standing  Apollo S Prepare  Laptop  FraudAccession  Past Life   Prepare  Prepare  Freemasons Romans  Building  Chosen One  F R A U D  ,Positivo
Magical season for  pompey  days so far  top of   LeagueOne and now  Champions   ,Positivo
Pillars of The New India  upsc  champions  aspirants  upscmotivation  winners  inspiration  nevergiveup  welldone  newbuild  officers  ,Positivo
What a moment I feel incredibly fortunate to be in the position I am with  Pompey and being able to capture scenes like this capturing such precious and great moments to share with the club and fans is just well fricken awesome   thismoment  champions  ,Positivo
CHAMPIONS             Beerschot    Ratte  DenBearIsBack  Kampioene WeAreBeerschot  WeDoWhatWeWant Kiel Champions  ,Positivo
Wahengbam Angousanas Heartfelt Tribute ILeague Victory a Testament to Family and Team Bond ManipurFootball  ManipurFootballPlayers  ILeague  Champions   Manipur  ,Positivo
What a season for   This boy has loved every minute   promotion  champions  pompey  ,Positivo
CHAMPIOOOONNS   Portsmouthfc  Champions  BlueArmy  PFC  ,Positivo
Bayern Munich Vs Arsenal Prediction   Let me know your prediction in comment section  champions  arsenal  football  BayernMunich  bettingtips  footballpicks  soccer  sportsbets  tips  bet  GamblingCommunity  bettingpicks  betting  ,Positivo
Congratulations to the Iranian wrestling team on their championship victory in Kyrgyzstan  Your hard work and dedication paid off  Wrestling  Champions  Iran  ,Positivo
       Real Madrid             MCIRMD                Champions League  ,Positivo
Real Madrid fans worldwide drop your handles now and lets follow you  ,Positivo
 BUUUUUUUUUTT DE RODRYGO  MAN CITY      REAL MADRID  ,Positivo
 ManCity Real Madrid to Man city  ,Positivo
Man City flexing their trophy to Real Madrid this evening  ,Positivo
Man City  shots  possession  cornersReal Madrid  shots  possession  cornerGoing to penalties  ,Positivo
 Nacho starts for Real Madrid Kroos also in the starting XI Lunin Carvajal Rudiger Nacho Mendy Valverde Kroos Camavinga Rodrygo Vinicius Bellingham  ,Positivo
Were all Bayern Munich and Real Madrid tonight arent we  ,Negativo
At the end we are Real Madrid   ,Positivo
Bayer Leverkusen have put a m price tag on yearold Florian Wirtz amid interest from Barcelona and Real Madrid Source Radio MARCA  ,Negativo
 Real MadridRODRYGO HAS OPENED THE SCORE AND REAL MADRID LEAD ON AGGREGATE  RODRYGO ONCE AGAIN WITH A HUGE MOMENT WHAT A PLAYER   ,Positivo
Tonight showed Man City are the best team in Europe No team has ever dominated Real Madrid like that Proud of this team  ,Positivo
 Fede Valverde They obviously played better football than us but were Real Madrid  ,Positivo
All Real Madrid Fans in the World  Drop  and lets foIIow ourselves  ,Positivo
Were all behind Bayern and Real Madrid tonight arent we   ,Negativo
Real Madrids best player today  ,Positivo
The dream of the double treble is over as Real Madrid knock Manchester City out of the Champions League on penalties They will face Bayern Munich in the semifinals BBCFootball  UCL  ,Positivo
Bayern Munich beat Arsenal  on aggregate in the  Uefa   to set up a semifinal clash with Real Madrid OnuaSports  ,Positivo
great player helped real madrid reach the ucl semis they should buy him  imo,Positivo
Real Madrid have parked the bus for  minutes Embarrassing,Positivo
Wait whatYou had equal no Of penalties your magician decided to go for Panenka your Croatian took a poor one as well just like ModricKdb amp Foden missed sitter amp Bernado missed a tap in what is he talking about,Negativo
Saka Foden were beyond those debates now  ,Negativo
Fodens standards are so fuckin low its so clear to see hes nowhere near being Citys main man,Negativo
Saka is nowhere near Foden and Palmer  good night,Positivo
Dont ever compare saka to Palmer or Foden Martinelli has just been shit all season And HAVERTZ oh myLord,Negativo
Just remembered that chance foden bricked nd half  his gun jammed today,Negativo
Foden ballon dor,Positivo
Comparing him to foden is plain criminal,Negativo
Foden will redeem himself with some half turns against wolves,Negativo
Phil Foden is the best player on Man Citys team and by far He is unbelievable  ManchesterCity  ManchesterCityRealMadrid,Positivo
Oi foden I love u mate but u aswell u cant run Stinky today,Negativo
Hopefully that puts paid to playing Foden on the fucking Wasted,Positivo
De bruyne gets blamed but Foden doesnt  ,Negativo
Odegaard is the same as foden They both get massively overrated because of aesthetic bias,Positivo
In the last  days Foden Salah and Saka all dropped stinkers yet all Im seeing is Saka slander Racismo no,Negativo
My Euros team Southgate starts Maguire                     Kane Foden        Palmer         Bowen                 Rice  JudeBShaw                                Walker            Stones     Maguire                                                Pickford,Positivo
Only players that should be untouchable going into  areHaalandKdb Rodri DiasFoden BobbLewisJoskoDokuEdersonThe rest we must entertain offers if they come,Positivo
yay now city can only field GrealishAlvarezDoku kovacicfoden rodriterrible team,Positivo
Once again it is an insult to compare this guy to MbappeKylian may disappear for  minutes but walahi he will come clutch in the last  minutes and give you a show to overlook his  minutes of noshow This guy doesnt have that in his armouryFoden and Alvarezgtgtgtgtgtgt,Negativo
First half we werent great but we dominated them The KDB amp Foden miss hurt us Madrid came to survive and defend Well done we move onto Saturday gonna be someTired legs,Negativo
The cat too upsetting The little cat shes dancing laughed again  DubaiFlooding  ManCity  BabarAzam    Dubai  ,Negativo
Real Madrid best Defender Antonio Rudiger  ManCity  UCL  MCIRMA  MCIRMD  Madridistas  RMPlay  RMTV  RealMadrid  RMCity  ,Positivo
After Speeds enthusiastic celebration of Rodrygos goal in the Man City vs Real Madrid game irked Man City fans they demanded that he end his stream in annoyance  ManCity  RealMadrid  ,Positivo
 RealMadrid qualifies for the  UCL semifinals after winning  on penalties Semifinals in  Years AndriyLunin  ManchesterCity  BernardoSilva RealMadrid ManCity  ManchesterCityRealMadrid  ETIHAD  ErlingHaaland  Kevindebruyne  ,Negativo
 LIKE   SOMO RT   SOMO COMMENT   SOMO QUOTE   SOMO Follow   SOMOLets grow  SOMO  farmers  SOMO  ManCity  ManchesterCityRealMadrid  ArtisanDeToutesLesVictoires  BAYARS  ,Positivo
Rodri has lost on penalties his first game since February  But to be honest with you I only saw one team tonight ManCity  UCL  MCIRMA  MCIRMD  Madridistas  RMPlay  RMTV  RealMadrid  RMCity  ,Negativo
Did you fade Anon Reply PARAM i will boost you            btc  ManCity    ManchesterCityRealMadrid  ,Positivo
Real Madrid players avoiding  ManCitys badge in the Etihad Stadium tunnel on Tuesday     ,Positivo
Todo list for    Farm PARAM Farm PARAM Farm PARAM Farm PARAMLIKE  REPOST  COMMENT PARAM  ManchesterCityRealMadrid  ManCity  ,Positivo
If you have less than  PARAM POINTSPLEASE GATHER HERE  like     PARAM  Rt          PARAM quote   PARAM replies   PARAMCOMMENT  TIMES FOR A MAX  BOOST  AskMikha  ManCity  ManchesterCityRealMadrid  ,Positivo
The moment Real Madrid eliminated Man City from the  ChampionsLeague   UCL  RealMadrid  ManCity  ,Positivo
Ice COld Bernado RealMadridManchesterCity  ManCity  UCL  ,Negativo
Cookies threeplatform ecosystem integrates analytics and AI to benefit users creators and businesses COOKIE    BAYARS  ChampionLeague  deprem  ManchesterCityRealMadrid  ManCity  RealMadrid  Airdrop Real City PARAM  ,Positivo
Your City side to face Real Madrid XI  Ederson Walker C Akanji Dias Gvardiol Rodrigo De Bruyne Bernardo Foden Grealish HaalandSUBS  Ortega Moreno Carson Stones Ake Kovacic Doku Alvarez Gomez Nunes Bobb Lewis ManCity   UCL  ,Positivo
Every Real Madrid fan will like this pictureTHIS IS BEAUTIFUL  ManchesterCityRealMadrid  ManCity  RealMadrid  halamadrid  MCIRMA    ,Positivo
Thank you all so much for the incredible support throughout our  UCL campaign Travelling far and wide to be right behind the lads       ManCity  UCL  MCIRMA  MCIRMD  Madridistas  RMPlay  RMTV  RealMadrid  RMCity  ,Positivo
Real Madrid will face   in the   semifinals UCL     ManCity  UCL  MCIRMA  MCIRMD  Madridistas  RMPlay  RMTV  RealMadrid  RMCity  ,Positivo
The city fans trying to steal the only penalty ball so delayed Bernardos penalty which he then fluffed  classic karma City fans stopped their double treble   ChampionsLeague  ManCity  ManchesterCityRealMadrid  ,Negativo
Eid ul fiter to IsraelWhat a surprise  AskMikha    BAYARS  BAYARS  deprem  ImpossiblePM  ManCity  ImpossiblePM  ManCity  ManchesterCityRealMadrid  ArtisanDeToutesLesVictoires    ghaza  palastine  Isreal  IranAttack  iran  ,Negativo
Pure teamwork by the Real Madrid goalies   UCL  ChampionsLeague  RealMadrid  ManCity  ,Positivo
THANK YOU REAL MADRID        ,Positivo
  Really,Negativo
They didnt believe God did,Negativo
Reyes,Positivo
Drop the iconic Ronaldo x Benz pic with Rodrygo plz  ,Negativo
himothy,Positivo
The Big Three,Positivo
Three Lions,Positivo
You do all my guy,Positivo
Thank you I love this club ,Positivo
We did it again Dis nah real Madrid,Positivo
This bellingham guy is trying so hard to  gain the clout,Negativo
it seems easy ke  you wey walker pocket you sare run go bench its always easy after a pen shootout omo werey,Positivo
Is this photoshopped,Positivo
I love u vini,Positivo
Today you play the game some,Positivo
