Tweet,Previsão
WHILE U WATCHING THE RICK ROSS DRAKE DRAMA THEY SWITCHING THE MONEY UP HELL WHILE U WATCHING THE TEUMP COURT BULL SHIT  THEY CHANGING THE MONEY UP  AskMikha  ManCity  BAYARS    ,Negativo
UCL  London will always be blueCOYB   BAYARS  HalaMadrid  ChampionsLeague  UCL  ManCity  ,Positivo
Unapologetic   fanNo Matter WhatWe Moveeeee UCL  ManCity  ARSBAY  ,Negativo
Bernardo Silva Reaction Tonight  ManchesterCityRealMadrid   ManCity  BAYARS  HalaMadridYNadaMas  ,Positivo
As a citizen since  i have  one thing to saySHIT PERFORMANS BY BERNARDOU SILVAH    SEND HIM TO BARCELONA RIGHT NOW  I DONT WANT HIM ANYMORE  LET HIM GO FOR FREE  I DONT CARELONG LIVE MANCHESTER CITY   ManCity,Negativo
Premier League is not Uefa  ChampionsLeague  Arsenal  ManCity  UCL  ,Positivo
We take the half cashMan City with the push Phillies with the easy win  L MLP uGiveaway  coming tomorrow GamblingX  ManchesterCityRealMadrid  ManCity  RealMadrid  ChampionLeague  UCL  CL  Phillies  MCIRMA  NBA  NBAPlayoffs,Positivo
Not surprised that  ManCity got eliminated from the  ChampionLeague QF with terrible performance If they cant win their last  matches in the premier league they will finish the year with zero trophies  after winning  last year,Negativo
love this team  ManCity,Positivo
Rodri actually lost  ManCity,Negativo
Chelsea fans beware What doesnt kill you makes you stronger    ManCity  ,Negativo
London will always be blue  COYB  ASSNAL  some joke thing  UCL  BAYARS  HalaMadrid  ChampionsLeague   CFC  COYG   ManCity  ,Positivo
Weekend creepingdeadass hyped  weekend  Wednesday  HumpDay  ManCity,Positivo
Its not talked about enough how bad Haaland is at heading the ball Even Messi clears him in heading abilityShameful haaland ManCity  MCIRMA  Guardiola,Negativo
Dem suppose Question Bernado Silva how much Madrid gave to him ManCity  ManchesterCityRealMadrid  UEFAChampionsLeague,Positivo
Hello palsGet your academic tasks perfectly done and timely deliveredWe deliver quality workalways and on time maths calculus algebra statistics spss trigonometryDm us MCIRMA  ChampionsLeague  ManCity  BAYARS  Arsenal  AskMikha  deprem  ManchesterCityRealMadrid  ,Positivo
Man Citys potential trophies won this season UEFA Super Cup  FIFA Club World Cup  Premier League  FA Cup Will still be a very successful season when we win the remaining two  ManCity  PremierLeague  FACup,Positivo
Dream League predicted the futureNo wonder Rodrygo and De Bruyne scored   quarter finals  ,Positivo
Rodrygo has been directly involved in    goals  goals amp  assists for   the same amount that Roberto Carlos managed for the club    ,Positivo
Rodrygo Silva de Goes    Big Game Player HAAALLLAA MADRID    ManchesterCityRealMadrid  ,Positivo
 Manchester CityRodrygo Silva de Goes  ,Positivo
At  years old Rodrygo has now been directly involved in    goals for    games  goals  assistsAnd hes only started  matches UCL  ,Negativo
rodrygo actually owns that club its hilarious,Positivo
 Says  hrs before st leg hes playing Rodrygo on the left Announces full team  working days before the nd leg Literally downplays any underdog narrative saying fans amp players are used to this kind of pressure Its just another day at the office  ,Negativo
The thing is in fact NONE of Rodrygo Vini Jude and even Brahim played a stinker tonight They kind of seem ghosted just because we lack possession,Negativo
Rodrygo yea what can I say Hes the best player in the world right now  Pep Guardiola post match  ,Positivo
Rodrygo ghosting in big Matches impossible man,Negativo
K Wallpapers  Rodrygo    Real Madrid   ManchesterCityRealMadrid  ,Positivo
hold this is the rodrygo these assnal fans were comparing to saka yall deserve the worst honestly   ,Positivo
Rodrygo Against Manchester City  ,Positivo
Real Madrid should give us Rodrygo as a thank you present for Rudiger,Positivo
 Rodrygo while giving the interview Look Pep Guardiola passed by giving me a stare     ,Positivo
    Rodrygo owns Manchester City,Positivo
Rodrygo be hardworking pass Vinicius,Positivo
And lets be honest rodrygo is indeed the new mr Champions League,Positivo
I just realized  we took vinicius  and  rodrygo  out  ,Negativo
I really wish Rodrygo gets this same PR cos hes a better but grandpa Perez wont agree,Negativo
Champions League   P Cuartos Final   Mier ABR                Manchester City   Real Madrid CF  PENARTIS Manchester City   Real Madrid CF                Bayern Munichem   Arsenal   ,Positivo
Real Madrid to Manchester City  MCIRMA  ,Positivo
Manchester City kkkkkkkkkkkkkkkkkk,Positivo
Manchester City fans are all saying they wish to have Bruno Fernandes in their team instead of bernardo silvaI laughed dieTg FA Cup champions league rudiga lunin palmer madrid trey de bruyne haaland saka odegaard celine dion musiala camavinga Guinness world record kepa arteta  ,Negativo
Manchester city you fucking idiots Losing at home to RM embarrassing,Negativo
Who the fuck is honestly excited about watching Manchester City play football Theyre the most soulless team of all time,Positivo
Manchester city Real Madrid Arsenal Bayern Bellingham Guinness book of records Kepa Bernardo Silva,Positivo
This penalty by Manchester City is hilarious lmfao  ,Positivo
Manchester city hold that mfs   ,Positivo
Manchester City cest grave ils savent tout faire les joueurs cest terrible,Positivo
The owner of Manchester City ,Positivo
Rodrygo Against Manchester City  ,Positivo
Despite losing to Real Madrid Manchester City dominated the game from start to finish and gave a good account of themselves For me they are the better side,Positivo
Manchester City had  corner kicks Madrid had  but they still got cooked,Positivo
Feels so bad being a Barcelona and Manchester City fan rn Double Heart break I can imagine how u  are feeling rn,Negativo
Manchester City were aiming for a second treble in a row They failed  ,Negativo
 Real Madrid beat Bayern Munich at Allianz Arena for the st time ever Chelsea won UCL Real Madrid best Chelsea at Stamford Bridge for the st time ever Manchester City won UCL Real Madrid beat Man City at Etihad for the first time,Positivo
 Bayern Munich won UCL Real Madrid beat Bayern Munich at Allianz Arena for the st time ever Chelsea won UCL Real Madrid best Chelsea at Stamford Bridge for the st time ever Manchester City won UCL Real Madrid beat ManCity,Positivo
BREAKING Manchester City are now facing  charges after Bernaldo Silvas horrific penalty  MCIRMD,Negativo
Pep GuardiolaCarlo Ancelloti Real Madrid Manchester cityOnly football fans can understand,Positivo
 UNUSUAL   Barcelona fans hurl missiles at own team bus thinking its  Champions League rivals  PSG  ,Negativo
City Champions A huge congratulations to our U Hockey team who have retained the City Championship title after a fantastic team performance at Aldersley last week  WeAreWGS  Hockey  Champions  Wolverhampton  ,Positivo
Congratulations to this fantastic squad of players on winning the   Div E league today as Partnership club Barking FC They will certainly enjoy the last game of the season next Weds as Champions  Champions   ,Positivo
I bloody love  pSpecials and what better way is there to celebrate Portsmouth FC becoming a Championship Team than playing Championship Manager on the PSP which was a p special pick up a few years ago Portsmouth  Portsmouthfc  champions  eflchampionship  efl  champs  ,Positivo
Real Madrid   is the Real Devils of   Congratulations  HalaMadrid  RealMadrid  RealMadridinSemiFinals  ChampionLeagueSemiFinals  UCL  Champions  RealDevils  ,Positivo
Amazing season for Radcliffe Football Club Taurus are so proud to be part of this fantastic journey radcliffefc  champions  ,Positivo
We are advocates of ethics Championing responsible and inclusive tech matching practices    MozzInc  WeAre  Champions  Responsibility  ,Negativo
What a thriller The finale was a nailbiter and the Colombo Dragons emerged as our first Team Tournament Champs  Missed out We got you More actionpacked tournaments are on the waysign up now and stay in the game ColomboDragons  Champions  cricket  gaming  fantasy  ,Negativo
We won with the boots  A heartfelt appreciation to the management  Championswhocares champions fwcchampionsFc  ,Positivo
Thanks to   for the fantastic coverage of our   Cleary Cup victory last week  Munster  Rugby  Champions  ,Positivo
This Saturday th April we will be Raffling off this Season winning signed Radcliffe Fc shirt charity  signedshirt  champions  uptheboro  ,Positivo
Didnt think it would take  years when I snapped this at the end of the last Championship game to be played at Fratton Park but YES WE ARE  Pompey  PUP  Champions        ,Negativo
Just got home found this on my desk  champions  ,Positivo
Portable and Spyro are cooking up a banger in the studio They got an hot one comingOdunlade Bobrisky Khaid Guinness World Record Cubana Chief Priest Yahaya Bello White Lion Korra Adekunle Gold gb  Dollar  MCIRMA  BAYARS   Champions  Maydayblogs  Maydayentertainment  ,Positivo
League One Champions Great result last night   A proud momentLooking forward to Championship football next season portsmouthfc  pompey  bluearmy  pup  champions  promotion  partnership  ,Positivo
New chapter to set sail on a path that goes beyond the sanity Live everyday past pm   twitchstreamer  twitch  twitchnoob  gamer  games  live  share  playstation  callofduty  eafc  warzonegrind  champions  varietystreamer  podcast   southafrican  ,Positivo
Send us up Paddy  All Hail Ming   champions  StockportCounty  penaltyking  ,Positivo
At the top beyond others thats   for you  JoyMohunBagan  Champions  ISL    ,Positivo
Its so divine   JoyMohunBagan  Champions      ,Positivo
May     Saskatoon  Saskatchewan Former  CWE  Champions Collide  s Zombie Princess Jimmy Jacobs vs x CWE  Champion    wrestling  aew  roh  ,Positivo
Funny how that Palmer Saka Foden debate died out so quick All of a sudden they dont care anymore when the boy is banging  goals with the likes of Harlaand,Negativo
btw Pep really gotta stop sticking Foden at RW its no coincidence we looked a lot more fluid when he and KDB were in the middle,Negativo
The Idea of Saka LB  foden LW and palmer CAM isnt far fetched then ,Negativo
Hows Foden better than Saka,Positivo
  he scored our only goal if anything if was that Foden scruff shot in extra time,Positivo
One of the few things Arsenal fans are right about Foden gets treated like a top  player in the world when he plays well but gets absolutely none of the scrutiny a player of that ilk should get when he plays badly,Negativo
They even said he is better than Foden because he knows how to limp,Positivo
Where all the Arsenal will beat Bayern Man City will demolish Real Madrid at Kepa Lunin Tuchel Kovacic Saka Foden  ,Positivo
  Mendy actually nullified Foden completely Didnt see him at all in this game,Negativo
Foden plays for City,Positivo
I will always say this Foden is a system player for Pep He isnt extraordinary tbh Cole Palmer might as well be a more talented player,Positivo
Why isnt Foden here,Negativo
    foden has won the ucl and every trophies he participated in and didnt drop a  rating tonight,Negativo
Foden was ass in both games BTW,Positivo
Fodens disasterclass Pick another topic please,Positivo
susah nk drop saka sebab saka ni kira dah senior palmermy england squad if saka and palmer play togetherramsdalearnold stones maguire chilwellbellingham ricesaka palmer fodenkane,Negativo
Oh yea you see that miss Foden had in extra time If that had been Saka or Rashford the narratives stemming from it would be CRAZY Goes to show how people view Man City and certain types of players,Negativo
This is what always happens with Foden,Positivo
Im seeing Saka get cooked but Ive legit seen  tweet on Foden,Positivo
Best player in the Premier League Foden and not a word of the tl about his ghost performance,Positivo
Haaland actually gave up tonight if you think deeply He just couldnt do anything and asked the coach to sub him out Peps head must be flyinggggg Those goals last season fooled everyone They were saying things like hes gonna surpass Cristiano in the CL I hate this app,Negativo
Haaland still hasnt scored against us,Negativo
Worldclass offensive players for the UCL quarter finalistsMan City  Haaland KDB amp BSilvaReal Madrid  Vinicius Jr amp BellinghamBayern Munich  Harry Kane amp MusialaPSG  Kylian Mbappe Arsenal  Like it or not we dont have the AlexisAubaRVP,Positivo
Is Haaland really a threat When compared to Messi ampor Ronaldo he is just a big body FodenDe Bruyne seem a bigger threat than him He is just part of set pieces amp scores when its easy He single handedly could have put the game out of reach today amp just could not,Positivo
Gunners were gunned down today Kovacic haaland  ManchesterCityRealMadrid,Positivo
Will be putting Haaland De Bruyne and Pep in my spliff tonight  citypack,Positivo
If Haaland was Sterling,Positivo
Have to add Haaland and KDB can no longer be added to any conversation of the greatest forwards or midfielders again The greatest players do what it takes to play and get their team over the line,Positivo
  Haaland and Big Games What a story,Positivo
Mbappe gt Haaland Dont get it twisted,Negativo
Akanji amp De Bruyne are understandable but Haaland wtf has he done all game to be requesting to be substituted ghosting in big games when it matter most and go on to stat pad against average clubs then suddenly get Balon Dor shouts pathetic ,Negativo
haaland and mbappe was never a debate ronaldo and messi really set a levels to this game only relevant till the age of lt,Negativo
  Alvarez has been in poor form for the last  months and his dip started from the Manchester derby back then Haaland was also appaling but atleast he blows hot and cold,Negativo
Haaland a pick up stray shots,Positivo
the way pep turned one of the best players in europe to a robotic one dimensional tapin merchant needs to be studied haaland is probably the last player a big team should worry about joselu is a more versatile striker when you dont gift acres of space in a game,Positivo
Haaland doesnt sit with Vini Jr or mbappe A true fraud,Negativo
I understand kdb and akanji HAALAND    your guy is a joke,Positivo
You understand that was just it lol cos that Kdb Haaland or Phils opportunity goes in on any good day its funny,Positivo
 passes over  matches is crazy Haaland is cooked,Positivo
Should never sub Haaland and Kdb,Negativo
Keep calm and sayhala Madrid,Positivo
  Vini Jr to Jude Bellingham on IG I told you this is Real Madrid,Positivo
Its easy to ghost and get carried by your teammates Shameless,Positivo
    Grave,Positivo
          Wdym haaland did nothing  ok kdb i can understand but haaland naaah and we also had vini jr subbed off for the last  minutes,Negativo
Thank you bossu,Positivo
Na nonsense una play last night,Negativo
  Vini Jr is a good player since ,Positivo
          Felicidades crack,Positivo
        i love them with my whole life,Positivo
  Vini Jr please you must live two much talk so that you can play your fulball well because you talk too much you can not play football angina,Positivo
  KrossCamavinga Valverde Bellingham Rodrygo Mbappe Vini JrBig away games in the Champions bench Rodrygo or Vini depending on form and add a th midfield,Positivo
Football heritage  HalaMadridYNadaMas  MiaSanMia,Positivo
  Bellingham is the front runner right now  depending on the outcome of ucl it can either be him kane or mbappe and the euros and copa america can cement it for one of them or give it to an wildcard like wirtz or vini jr Personally I think Bellingham is a safe bet this year,Positivo
      asked the club about the health of Vini Jr and Dani Carvajal The club replied They are dancing in the locker room with the music super loud,Positivo
Seems easy after you ghosted again tonight,Positivo
Kane v Bellingham v Mbappe v Vini Jr for this Ballon Dor,Positivo
  Not easy,Positivo
  Humble Bayern,Positivo
  i love you,Positivo
 Andreas Pereira Saka better than Rodrygo Rodrygo From Real Madrid laughs Nah your opinion is different I like Saka I think hes amazing but Rodrygo can play in all positions plays for Real Madrid    ,Positivo
Carlo Ancelotti turned Real Madrid into cowards today,Positivo
Real Madrid boi halamadrid,Positivo
Arsenal FC years without a title  years without Carabao Cup UCL   Europas  Super cups  Club World Cup Never defended a prem title  The fanbase has the audacity of Real Madrid but in reality theyre closer to Blackburn Just stat padded fa cups,Negativo
ALLAHU AKBAR YES  declares Antonio Rudiger on mainstream TV after he scored the winning penalty goal to make his team Real Madrid go to the next round in  ChampionsLeague  ,Positivo
Congratulations to Toni Rdiger One of the best defenders in the world for a reason Locked HallandConverted the penalty to send Real Madrid through  Rudiger  COYB  CFC  ,Positivo
THIS IS REAL MADRID THE TEAM OF DREAMS,Positivo
Real Madrid had to wear All Black  for Man City funeral in the Quarter finals of the champions League  RealMadrid  RMAMCI rudiger de bruyne Haland Bernardo pep guardiola Ancelloti  ,Negativo
Real Madrid is actually the biggest club in the world,Positivo
Been in Old Traffords museum  its full of travelling Real Madrid fans,Positivo
Man City vs Real Madrid Bayern vs Arsenal  Whoever predicts the score line for both games correct wins ,Positivo
Real MadridNoticeCase confirmed Avril te anba moun septembre   ,Positivo
Pray for BayernGive us Real MadridIts lonely at the topNo one deserves this pain more than you,Negativo
As Madrid win the penalties people say what a show of resistance perfect  defending defensive masterstroke   If they had lost the penalties Real didnt attack it is not the way to defend agaisnt City how can Real play this wayIn fact what happened City was superb just needed that de Bruyne chance to go in or Halland header to hit the bar and go in Real Madrid couldnt do much more than they did City did a huge amount of things but needed a little bit of luck,Negativo
Imagine where I watched the match and someone saying Luton Town will beat Real Madrid,Positivo
 Ruben Dias Penalties is what Real Madrid wanted,Negativo
Resolution Champions League Man City vs Real Madrid Resolved to MADRID ,Positivo
Against the odds Were Real Madrid MCIRMA  ChampionsLeague ManchesterCityRealMadrid  AskMikha  ,Positivo
Real madrid,Positivo
Do you guys think Real Madrid deserved to win,Positivo
everytime i watch rodrygo play i cant help but think hes the perfect guardiola system player can play across the front  can slow the game down and keep the ball if he needs to knows exactly when and how to beat his man and use his pace to do so and is an incredible finisher,Negativo
Rodrygo did what Rodrygo does todayThese   World Cup Prizm Silver  Autos end today Will his cards finally get some love  ad Bid Now     ,Positivo
Rodrygo really goes into his best form for UCL TOO BAD I FORGOT TO PLACE MY BET TODAY,Negativo
It is safe to say that Rodrygo Goes  owns Manchester city  ,Positivo
When he criticizes Vini or Rodrygo no problem but when I criticize Bellingham he suddenly starts barking like a dog,Negativo
Rodrygo Goes the name on big UCL nights Youve really improved and literally following the GOATs footsteps in your own way The best,Positivo
Rodrygo deserves this amount of PR not ghost rider,Positivo
Guaudiola would have scammed a win if Ancelotti hadnt finally clocked Rodrygo is their best player,Positivo
we rightfully talk abt mancity rodrygo but we should also talk abt mancity rudiger brev look at the man,Positivo
Thank God for d substitutes Had it been rodrygo and vini were still on the pitch then i dont think we will go through,Positivo
Rodrygo hitting his best form with all of the trophies on the line Saka,Positivo
See as everywhere calm Nobody comparing Saka with Rodrygo nobody shouting about the UCl final no noise those empty Barrels are out,Negativo
ANDRIY LUNINCARLO ANCELOTTINACHO FERNANDEZFEDE VALVERDEDANI CARVAJALRODRYGO GOESVINICIUS JUNIORLUCAS VASQUEZEDER MILITAOBRAHIM DIAZFERLAN MENDYANTONIO RUDIGERJUDE BELLINGHAMTONI KROOSEDOUARDO CAMAVINGAI WILL ALWAYS LOVE YOU GUYS TILL INFINITY AND BEYOND,Positivo
Endrick and Rodrygo gonna show levels next season Cannot wait,Positivo
Jude as a central outlet is a cheat code You can literally lump the ball up to him in any situation like the Rodrygo goal and hell make the ball stick and then have the intelligence to do the right thing with it This is the quality that many arent realising with him this season he is gluing a lot of Real Madrids attacks together without the presence of Benzema,Positivo
Vini and Rodrygo didnt protest too much when they got subbed out,Negativo
    Rodrygo has become Pep Guardiolas nightmare,Negativo
Rodrygos a lot better than Vinicius imo,Positivo
I think Rodrygo has the best first touch but Jude is close,Positivo
Better than Rodrygo they sayi duno ,Positivo
 BLAST IT FUCK MANCHESTER CITY,Positivo
Average Manchester City fan,Positivo
Andy Vermaut sharesMan Citys Treble dreams left in tatters by Real Manchester Citys dreams of winning a second successive Treble were left in tatters by Real Madrid writes Phil McNulty   Thank you  ,Positivo
Rodrygo may have  problems but Manchester City aint one of them,Positivo
Manchester city lost and its the Barcelona fans who are crying,Negativo
Carlo Ancelotti praised his Real Madrid teams resilience in their penalty shootout win over Manchester City in the Champions League saying everybody gave us up for dead but Real Madrid never die    ,Positivo
LETS ALL LAUGH AT MANCHESTER CITY,Positivo
Manchester City is losing but its the other team in Spain that is in pains,Negativo
My team is not in UCL this season but have been happy with results of UCL QFs Barcelona out Manchester City out And of course the kekeres of London Arsenal have been kicked out of UCL for this season Which football club do you think i support,Positivo
The game of football is all about winning it doesnt matter how you play it good or bad just winManchester City we go again next season   ,Negativo
Im convinced that Madrid defended very well staying compact They might have learned from Arsenal who managed to limit Manchester City to just one shot on target when they played at the Etihad Real Madrid likely applied similar tactics and capitalized on their opportunities,Positivo
Fuvk you Manchester city i hate you so much,Negativo
A sad short story for Manchester city and Arsenal fans but intriguing for Chelsea and Manchester United fans Arsenal and Manchester city were eliminated from the champions league by Bayern Munich and Real Madrid respectively   Chelsea  Arsenal  BAYARS  ManCity  deprem  ,Positivo
Arsenal Manchester City get in there,Positivo
  Bellingham enjoys beautiful Real win as Pep rues missed chances Jude Bellingham revelled in Real Madrids beautiful penalty shootout win over Manchester City which sent his side into the Champions League semifinals while Pep Guardiola  NewsStory  ,Positivo
Manchester Citys Treble dreams left in tatters by Carlo Ancelottis Real Madrid  ,Positivo
Manchester City vs Real Madrid    via  MCIRMA  UCL  ChampionsLeague,Positivo
People dont understand that no league will have peace with Peps Manchester City in it,Negativo
Manchester City has a focus advantage on the EPL title race amp FA Cup,Positivo
Real Madrid triumphs over Manchester City in Champions League shootout    RealMadrid  ManchesterCity  ChampionsLeague,Positivo
From  Real Madrid played  consecutive UCL semifinals and won  finals Then from  they have played  consecutive semifinals and have won  final and counting They are not an extraordinary team but a supernatural one Know this and know peace RealMadrid,Positivo
To those European teams who fear Man City tell them Real Madrid has opened the way  HalaMadrid  RealMadrid,Positivo
To those European teams who fear Man City The Real Madrid has opened the way  HalaMadrid  RealMadrid,Positivo
UCL beastss  RealMadrid,Positivo
Why Guardiola and Ancelotti Have Opposite Philosophies   realmadrid  ch   via  ,Positivo
Cobra reply amazing   RealMadrid  Dubai    ,Positivo
Now that semifinals are known I wish  BVB to win it all followed by  Bayern then  PSG I wish  RealMadrid nothing but bad luck I wish they get destroyed by Bayern  UCL  MCIRMA  mcirmd,Negativo
This is  REALMADRID,Positivo
Llevo Tu Camiseta Pegada Al Corazon Madrid Hala Madrid Y Nada Mas   I Wear Your Shirt Tight Right Next To My Heart ManchesterCityRealMadrid  ChampionLeague  RealMadrid  rudiger  lunin,Positivo
 ways to impress a lady on first date Thread RMAMCI  BAYARS  realmadrid  ManCity,Positivo
Lucas Vazquez truly bold Juggling with his penalty displaying extraordinary confidence  RealMadrid  LucasVazquez,Positivo
Carlo Ancelotti has become the first coach to eliminate Pep Guardiola from the Champions League in three different campaigns after Real Madrid beat Manchester City on penalties in the quarterfinals    Ancelotti  RealMadrid  UCL  MCFC  Guardiola,Positivo
May the best team win  UCLToday  ManCity  RealMadrid,Positivo
Champions so proud of you guys  ChampionLeague  ManchesterCityRealMadrid  RealMadrid,Positivo
 RealMadrid  ChampionLeague  kampfderrealitystars  MajosA ManchesterCityRealMadrid AktenzeichenXY  ManCity BAYARS    MCIRMASOMETIMES YOU CANT TELL THEM THE TRUTHYOU MUST SHOW THEM ,Negativo
 realmadrid plays it very smart MCI was compleet finished out of energie after total time  real not for me the winner with good football  but thats how it goes de better team not the winner after All  Tja  RMAMCI,Positivo
Dreams of another treble are over for   after their   quarterfinal loss to   Heres my match report  mcfc  realmadrid  MCIRMA  ,Positivo
Champion of Europe eliminated Rodrygo Citys master scores again Outstanding performances from Lunin Camavinga Carvajal Valverde Rdiger Bellingham Iconic semifinal against Bayern See you Sunday to take on our rivals Bara   RealMadrid  ChampionsLeague  ElClasico,Positivo
