Tweet,Previsão
really easy bro you won on penalties  MCIRMA  MCIRMD  ChampionLeague,Positivo
Show me a better trio,Positivo
Haaland doesnt sit with Vini Jr or mbappe A true fraud,Negativo
Next time  shun dey fool and pass early balls to your mate,Positivo
IM I THE ONLY PREMIER LEAGUE FAN THAT LOVES THIS MANCHESTER CITY DEFEAT   ,Positivo
Gaffer Manchester City are dominating football now and they attack a lotCarlo  Thats where Lunin comes in  ,Positivo
The dream of the double treble is over as Real Madrid knock Manchester City out of the Champions League on penalties They will face Bayern Munich in the semifinals BBCFootball  UCL  ,Positivo
RUDIGER SCORESManchester City Real Madrid REAL MADRID ARE IN THE SEMI FINAL OF THE CHAMPIONS LEAGUE   ,Positivo
LETS ALL LAUGH AT MANCHESTER CITY,Positivo
 Manchester CityRodrygo Silva de Goes  ,Positivo
And semifinals is what Manchester City wanted but here we areHooollllllllllld  ,Negativo
 Manchester CityKEVIN DE BRUYNE HAS EQUALIZED  MASSIVE MOMENT FOR CITY   ,Positivo
    Rodrygo owns Manchester City,Positivo
Manchester Citys dreams of winning a second successive Treble were shattered by Real Madrid Find out more about the thrilling match in Phil McNultys latest blog post    ,Positivo
UEFA CHAMPIONS LEAGUE to Arsenal and Manchester city   ,Positivo
Real Madrid Upsets Manchester City in Champions League Epic  Real Madrid edges out Manchester City to reach UCL semifinals after an intense match and penalty shootout Read more about thi  ,Positivo
Whos Manchester City playing next in the EPL In fact restart the season  Because Pep is in pain and its not looking good at all   ,Positivo
Manchester City  Real Madrid More info    ,Positivo
Manchester City and Arsenal out of the UCL Liverpool Chelsea and Manchester United fans  ,Positivo
Please  mercy for us on SaturdayCHELSEA vs MANCHESTER CITY  FA CUP SIMFINAL,Positivo
 Bayern Munich won UCL Real Madrid beat Bayern Munich at Allianz Arena for the st time ever Chelsea won UCL Real Madrid best Chelsea at Stamford Bridge for the st time ever Manchester City won UCL Real Madrid beat Man City  ,Positivo
Jude Bellingham vs Manchester City  ,Positivo
Manchester City lost but its Barcelona thats suffering the most Signs of a finished team wei,Negativo
I have this over and over Manchester City has no fans its just disappointed Barca fans supporting them,Negativo
Thank you to everyone who fought for this slogan RealMadrid  ,Positivo
Los fuckng Blancos  RealMadrid  ,Positivo
Sad faces if you are Manchester united fan  Dubai  ChampionsLeague  RealMadrid  ,Negativo
No Real Madrid fan will pass without liking the post RealMadrid  HalaMadrid  ChampionsLeague  ManCityRealMadrid   ,Negativo
INDEED IT IS ManchesterCityRealMadrid  MCIRMA  ManCity  RealMadrid  ,Positivo
Were Real Madrid  RealMadrid    ,Positivo
Official fixture dates  FCBayern   RealMadrid  Tuesday April   CET Allianz Arena Munich   RealMadrid   FCBayern  Wednesday May   CET  Estadio Santiago Bernabu Madrid UCL  ,Positivo
Im following all Real Madrid fans right nowKindly drop your handles and RT MCIRMA   RealMadrid  Lunin  Rudiger  Guardiola  Lunin  Haaland  ,Positivo
I love this club  Hastaaaa El Final  HalaMadrid  RealMadrid  ChampionLeague  ,Positivo
Real Madrid best Defender Antonio Rudiger  ManCity  UCL  MCIRMA  MCIRMD  Madridistas  RMPlay  RMTV  RealMadrid  RMCity  ,Positivo
Remember the day and the timeRemember  HalaMadrid Madrid makes it past the Manchester city  ChampionLeague  MCIRMA  CL  ManCity  RealMadrid  RealMadridManchesterCity  ,Positivo
After Speeds enthusiastic celebration of Rodrygos goal in the Man City vs Real Madrid game irked Man City fans they demanded that he end his stream in annoyance  ManCity  RealMadrid  ,Positivo
Greatest of all time This is my love  HalaMadrid RealMadrid ManchesterCityRealMadrid ChampionsLeague Guardiola Bernardo Silver Bellingham Lunin Rudiger  ,Positivo
Real Madrid are through to the champions league semifinals Congratulations to the White House  realmadrid  Trending  TrendingNow  TrendingNews  ,Positivo
 RealMadrid qualifies for the  UCL semifinals after winning  on penalties Semifinals in  Years AndriyLunin  ManchesterCity  BernardoSilva RealMadrid ManCity  ManchesterCityRealMadrid  ETIHAD  ErlingHaaland  Kevindebruyne  ,Negativo
Andriy Lunin appreciation post  HalaMadrid  RealMadrid  ChampionsLeague  UEFAChampionsLeague  ManchesterCityRealMadrid  ,Positivo
Real Madrid is typically associated with galacticos and superstars but if anything defines los blancos the white blood the win at all costs its these two guys HalaMadrid  RealMadrid  MCIRMA  ,Positivo
Antonio Rudigers penalty kick sends Real Madrid through to the SemiFinals of the Champions LeagueThey have defeated the Champions Manchester City on home soil  on penalties ChampionsLeague  Rudiger  RealMadrid  ManchesterCityRealMadrid  ,Positivo
Rodri has lost on penalties his first game since February  But to be honest with you I only saw one team tonight ManCity  UCL  MCIRMA  MCIRMD  Madridistas  RMPlay  RMTV  RealMadrid  RMCity  ,Negativo
Who you got for the finals Dortmund v  PSG Real Madrid v  BayernIm going with PSG vs Real Madrid To me those are the best two teams right now and the Mbappe RM narrative is just too strong ChampionsLeague  Dortmund  PSG  RealMadrid  Bayern  Mbappe  ,Positivo
people wanted rodrygo sold ill never forget that,Negativo
pep when he saw rodrygo  ,Positivo
Vinicius on Rodrygos instagram   ,Positivo
everyone doubted rodrygo not me thoughvisionary,Positivo
 Real MadridRODRYGO HAS OPENED THE SCORE AND REAL MADRID LEAD ON AGGREGATE  RODRYGO ONCE AGAIN WITH A HUGE MOMENT WHAT A PLAYER   ,Positivo
Rodrygo keeps appearing in his dreams,Positivo
This guy ghosted the entire match but its his image going viral This guys PR is insane wish they could do same for rodrygo cuz hes better,Negativo
Pep to rodrygo next season you know mbappe is coming come to city,Positivo
Drop the iconic Ronaldo x Benz pic with Rodrygo plz  ,Negativo
Better than Rodrygo   ,Positivo
 Andreas Pereira Saka better than Rodrygo Rodrygo From Real Madrid laughs Nah your opinion is different I like Saka I think hes amazing but Rodrygo can play in all positions plays for Real Madrid    ,Positivo
Rodrygo kind of owns City doesnt he,Negativo
Just seen the Rodrygo goal Kyle Walker with a defensive lapse where his pace cant get him out of trouble and he actually has to use positional sense shock horror Then offers minimal positive contributions in possession Trent surpassed him half a decade ago Reece surpassed him in  He should not be starting for England at the Euros,Positivo
man dem were giving me Saka gt Rodrygo shouts yunnofokin ridiculous,Negativo
Pep Guardiola passed by Rodrygo during a postgame interviewRodrygo Look Pep just passed by and gave me a stare  ,Positivo
 Nacho starts for Real Madrid Kroos also in the starting XI Lunin Carvajal Rudiger Nacho Mendy Valverde Kroos Camavinga Rodrygo Vinicius Bellingham  ,Positivo
Gotta be one of the most embarrassing fanbasesClaiming Real Madrid victories as if Rodrygo is gonna come drop off the Champions LeagueMost this fanbase says they wanna be like Madrid but do the complete opposite Ten Hag in when hes failed Wouldve been sacked at Madrid,Positivo
Pep Guardiola apparently passed by Rodrygo amp side eyed him while he was doing a post match interviewRodrygo in the interview Look Guardiola passed by giving me a stare laughs     ,Positivo
We love happy rodrygo   ,Positivo
 Vini Jr to Rodrygo Mr Champions League  ,Positivo
So Haaland could score  goals and not be the best footballer in the world Thats insane Scoring Goals are the most difficult thing to do in football,Positivo
Injuries Akanji  MCI gt Knock   chance of playing  De Bruyne  MCI gt Knock   chance of playing  Haaland  MCI gt Knock   chance of playing  FPL  FPLCommunity  ,Positivo
Watched mins of game during a major meeting Caught rest walking to car listened to AET driving home stopped for beers Watched penalties in the car outside home Now on my couch sipping whats meant to be celebratory beers So proud of my team Love you MCFC  CityTillIDie,Positivo
Exploring the galaxy of pixels one wallpaper at a time  Tags   PioneerPixels   DigitalFrontier  RMAMCI  Treble  Ancelotti  Bellingham  Haaland  Arsenal  Pastor  Guardiola  DSTV  Doku  Real Madrid  Bernardo Silva  Bayern Munich  Kane  Musiala  Mario   ,Positivo
Bernardo Haaland and Walker can fk off to Barcelona or wherever they want They dont do shit anyway here atm,Negativo
wait haaland asked to be subbed out Yh hes exactly what I thought he was,Negativo
Kdb I understand but Haaland,Positivo
haaland going out sad in big games unlike,Negativo
Haaland was more than fine lol,Positivo
Cant believe they were comparing mbappe and Haaland to Messi lmaooooooooo,Negativo
Brahh Haaland and bubblegum are literally gay besties,Negativo
With Haaland out of the picture Messi is the clear favorite,Positivo
We expected him to do everything And again Haaland was nowhere to be seen,Negativo
Bottlers Nothing more nothing less Embarrassing from Haaland and De Bruyne,Negativo
Manchester City fans are all saying they wish to have Bruno Fernandes in their team instead of bernardo silvaI laughed dieTg FA Cup champions league rudiga lunin palmer madrid trey de bruyne haaland saka odegaard celine dion musiala camavinga Guinness world record kepa arteta  ,Negativo
Haaland literally get the fuck out of this first team until you grow a pair of balls I was scared Madrid will sign him up lmao,Negativo
Ronaldo revisionism to compare him to Haaland what the actual hell are we doing here,Positivo
Its not talked about enough how bad Haaland is at heading the ball Even Messi clears him in heading abilityShameful haaland ManCity  MCIRMA  Guardiola,Negativo
KDB and Haaland wanted to be taken out Unless it was something serious its a terrible call by such elite players,Negativo
Haaland What did he actually do on the pitch to get tired,Negativo
 win in  game  European Cup   in Turkish League   Champions  Fenerbahe  PotannKralieleri  YellowLegacy  FenerbahceAlagoz  ,Positivo
Weve done it Medics win the   Cup Final against    with goals coming from Pete Nicholls and Jamie Bedford Our first silverware since  big things still to come for this young team LMDAFC  champions  yorkshire  ,Positivo
Up Arsenal    champions  debruyne  ,Positivo
Un remake svp  ChampionsLeague  LDC  Champions  ,Positivo
So proud of us On to round   champions  district  undefeated                              ,Positivo
CONGRATULATIONS TODAYS GAME WONJOIN THE WINNING TEAM TODAY AND TESTIFY  Odunlade Bobrisky Khaid Guinness World Record Cubana Chief Priest Yahaya Bello White Lion Korra Adekunle Gold gb  Dollar  MCIRMA  BAYARS   Champions  Maydayblogs  Maydayentertainment  ,Positivo
After winning the Regional Junior Premier League at the weekend our Us won their final match this evening to secure the Mid Sussex Youth League Division  titleA fantastic achievement securing two league titles in  days  leaguewinners  football  champions  ,Positivo
Congrats to the Louisiana Bombers uMadison for winning the Angels  Autism tournament  champions  bombernation  ,Positivo
Proud is an understatement   CHAMPIONSTexas Twelve Teams Katy u Maroon  San Antonio u Maroon  College Station u Maroon  South Texas u Black  TwelveLife  ,Positivo
Our captain  What a night  champions  ,Positivo
Huge congrats to the U girls who were crowned Beds County  Girls  Futsal  Champions last month They showed great composure on the ball whilst playing some fantastic football which resulted in them  winning every game Great  sportsmanship displayed by all  well done girls  ,Positivo
Here comes the  CHAMPIONS StockportCounty  ,Positivo
Just when I thought the night couldnt get any better I go and bump into    a real nice fellaFinally got a dance in after months of practice in front of the wife and baby  PUP   Pompey  champions  ,Positivo
Congratulations to our   Softball Team  BacktoBack District  Champions     is proud of you  ,Positivo
City Champions A huge congratulations to our U Hockey team who have retained the City Championship title after a fantastic team performance at Aldersley last week  WeAreWGS  Hockey  Champions  Wolverhampton  ,Positivo
Drumroll please  Its time to reveal the winners of our mascot hunt contest Congratulations to all our winners for their outstanding creativity and enthusiasm Cheers to our champions ClubMahindra  MascotHunt  MascotHuntContest  WinnersOfMascotHunt  Winners  Champions  ,Positivo
UBB Gold ends an incredible season with a bang  A tournament victory at the Newmarket Spring Thaw caps off a phenomenal win season This teams dedication and hard work paid off in dominating fashion with a  Record Congratulations  Champions  Wins  ,Positivo
Rt   These are the winners of the New Champions Awards    champions  innovation  ,Positivo
Another Ulster Success Huge congratulations to Blossom Amy and Isobel on winning the Ulster UC Final with Loreto todayCongrats to all involved Enjoy the celebrations girls the club are super proud  LoretoCollegeCavan  Champions    ,Positivo
What a night  Pompey  Champions  ,Positivo
Ah Foden play some,Positivo
 takeawaysBellingham was wank at Dortmund didnt do anything in  legs for MadridMadrid played like Stoke madnessBernardos penalty was shite still a legend scored  in the same game last year Foden and De bruyne doesnt work Haaland is crap,Negativo
What did foden do today,Positivo
Lol no word on Foden Oya na,Negativo
Man Citys exit from the Champions League should show the board and Guardiola that serious attacking reinforcements are needed in the summer transfer windowFoden isnt effective from the RW so thats a position we need looking at We need Gundogan  to chip in with goals,Negativo
At least Foden scored the pen,Positivo
Foden Im happy he fold at last,Positivo
Foden didnt have one more in him ,Negativo
See chances we missedthat kdb chance bro the one foden scrapped and the haalands header that came of the post,Positivo
Arsenal fans asleep Conversations about Saka need to be had I dont even think he should be stating for England Foden is clear too,Negativo
Fck offfff pep fckkk off Haalandfckkk off Foden Fckkk off KDB Haaland its time to get out Pep for buying substandard players and selling Mahrez Gundo This loss is on you Fckkk of Gvardiol every time he has the ball it feels were gonna lose the possession,Negativo
Foden is not Man Citys best player Bellingham is not Reals best player We cannot rely on Saka as our best player We need to strengthen in all positions in the summer and that includes the managerial position Else we will here again next season with another failed attempt,Positivo
Hot take weve reached the eitheror with KBD and Foden at the  Foden is wasted out wide The team performs better with Foden at the  What are we doing,Positivo
Jude Bellingham Florian Wirtz Phil Foden Cole PalmerThe return of the  ,Positivo
Is Haaland really a threat When compared to Messi ampor Ronaldo he is just a big body FodenDe Bruyne seem a bigger threat than him He is just part of set pieces amp scores when its easy He single handedly could have put the game out of reach today amp just could not,Positivo
saka and foden both stunk today but only one is getting cooked hmmmm observing,Positivo
  Hes not  Palmer and Foden better Saka only better than Rashford,Positivo
we all gonna pretend Foden didnt kick ball today aiit,Negativo
Terrific effort to pin Real back for entirety of that second half Some tired legs out there but praise due for  minutes that gave Real no options at all but to defend with all they had Akanji superb but too many big chances Bernardo De Bruyne Foden Haaland went begging,Negativo
Where are all the Foden is the best player in the universe people    I love you and your team but talk about someone who was invisible in the biggest game of the year Everyone relax KDB is still the man in charge,Positivo
Next big thing is TRIP BLOCK PARAM EVERY BUBBLE COOKIE  Saka Ederson Haaland Clement FOMO  ,Positivo
Next big bang on coin is TRIP BLOCK PARAM EVERY BUBBLE COOKIE  De Bruyne Haaland Grealish Arda  deprem  ,Positivo
Its such a binary take Haalands all around game is obviously not at the same level of other elite players But his goalscoring is at a level weve never seen in the modern gameChampions League goals per gameHaaland Messi Lewa Ronaldo Mbappe ,Positivo
Pep said Haaland has been playing with pain and just now he started feeling comfortable I feel like their is something we dont know,Negativo
Haaland aint a goat tier score shame,Negativo
Erling Haaland and Kevin De Bruyne asked to come off before Man City penalty heartbreak Erling Haaland and Kevin De Bruyne were both substituted by Pep Guardiola  erlinghaaland  kevindebruyne  pepguardiola    ,Positivo
Haaland has gone from a scoring machine that was on top of the world to a bum yes I know hes tied for the PL golden boot,Positivo
Im not even the biggest messi fan but I want to thank him for making sure haaland did not touch that ballon dorwhat a fraud,Positivo
Haalands chain is fake btw,Positivo
Saka Klay Haaland In that order,Positivo
Imagine thinking he deserved the ballon dOr over Messi last season and then thinking hes better than mbappeboth are overrated by the way but mbappe is miles clearHaaland keeps giving this world cup Ronaldo vibes in big gamesIts why Guadiola doesnt rate him too,Negativo
Haaland slander feed me for generations too,Positivo
We need to have a conversation about haaland,Positivo
Two takeaways from the  MNCRMA game One if you man mark Haaland like Rudiger did the Norwegian wont get a sniff Thats a memo to all Premier League central defenders Two did Luka Modric kick the ball into the crowd after his pen miss deliberately If so that was genuis,Negativo
Fucking hate Haaland,Negativo
Haaland is really a limited player The premier league defenders need to step up,Negativo
How can you say Haaland goes missing all the time but when Hjlund does its because he doesnt get service I see exactly the same City dont know how use him and Peps tactics dont help the man at all,Negativo
I just look at the past gen of s Lewa Suarez Kane Aguero even Auba How many s do we have close to this in this generationHaaland gets those numbers but other than him Tough to get a striker in this market sigh,Negativo
Erling Haaland the only striker who gets criticized for only scoring goals while bums like Hojlund Nunez and Jesus gets praised for their allround play because they contribute more to the team playthey are fing strikers they need to be judged on goals tf is all round play,Positivo
Rudiger what a colossus To want to take on the challenge of physically nullifying Erling Haaland and pulling it off over  games and then taking the th penaltyimmenseFlorentino Perez sent him that letter in  to ignite the dream and tonight hes living it RealMadridManchesterCity  RealMadrid  Rudiger  MCIRMA,Positivo
Very easy amigo,Positivo
  Monstro,Positivo
  I dont understand TF you wrote Congratulations XTER for you and your amigos,Positivo
As i always say rodrygo is far better than vini jrBuh the hype around vini is massive,Positivo
pic is so cold,Negativo
Havent a clue what you said mate but VAIIIII VINI,Negativo
 useIess Barca fans bookmarked this thinking they could cook,Positivo
You were brilliant today,Positivo
Lmaooo easy una see this mugu,Positivo
Los reyes,Positivo
The Best,Positivo
Starboy left it all the pitch,Negativo
scamming,Positivo
Bro gtfo it would have been easier if you passed that ball,Positivo
Yes we know,Positivo
Incroyable la photo,Positivo
Give it to them,Positivo
But woab hwee o,Positivo
Oomfs being racist to vini Jr ,Positivo
  LEGEND,Positivo
RUDIGER SCORESManchester City Real Madrid REAL MADRID ARE IN THE SEMI FINAL OF THE CHAMPIONS LEAGUE   ,Positivo
Real Madrid will play the second leg of the semi finals at Bernabeau Im calm   ,Positivo
Tuchel against Real Madrid   ,Positivo
OFFICIAL Bayern will face Real Madrid in the Champions League semifinal  ,Positivo
Real Madrid players avoiding  ManCitys badge in the Etihad Stadium tunnel on Tuesday     ,Positivo
Real Madrid have snapped Rodris game unbeaten streak  ,Negativo
endrick too is cooking man real madrid ankasa   ,Positivo
Imagine Man city DOMINATE Real Madrid through out the game but non of there players win the man of the match Thats means man city were playing rubbish omg   ,Positivo
Your City side to face Real Madrid XI  Ederson Walker C Akanji Dias Gvardiol Rodrigo De Bruyne Bernardo Foden Grealish HaalandSUBS  Ortega Moreno Carson Stones Ake Kovacic Doku Alvarez Gomez Nunes Bobb Lewis ManCity   UCL  ,Positivo
 years old Carlo Ancelloti is the best manager in the world by miles Hes proven himself without showing emotions or disclosing sideline antics Carlo is a human with big brains for football My kind of guy Good game  Everyone thought we were dead but Real Madrid never dies,Negativo
 First team to beat City at the Etihad since  in UCL Ended Citys  game unbeaten run Ended our curse of not winning at the Etihad ever Only team to qualify for  SFs in last  yearsLadies and Gentlemen this is REAL MADRID for you  ,Negativo
Jude Bellingham is Living the DREAM at Real Madrid MCIRMA  UCL  Bellingham  ,Positivo
The blueprint to beating Real Madrid    ,Positivo
Madrid fans from Mexico and Islamabad coming out of their caves and tweeting THIS IS REAL MADRID after not watching a single game this season  ,Positivo
 Real Madrid qualify to UCL semis Barcelona and Atltico eliminated  Pep amp his students Simeone and Griezmann humbled   Al Hilal thrashed  Al Bulayhi disasterclass Referee that gave Ronaldo a red card is in hospital ONE OF THE GREATEST WEEKS IN HISTORY OF FOOTBALL  ,Negativo
Jude leading the jubilations of Real Madrid MCIRMA ,Positivo
If this guy gets a sniff of the pitch against Real Madrid I can guarantee you hes either gonna start shagging Vinicius mid game or score an own goal  ,Positivo
Good night everyone We lost half our lifespan but we are through to the SemiFinal of the CL We were average on the ball but the team fought his heart out tonight Thats what Real Madrid is standing for  UCL  ,Positivo
GOOD NIGHT  REAL MADRID FANS,Positivo
Erling Haaland in the st leg vs Real Madrid  minutes played  goals  assists  shot on targetErling Haaland in the nd leg vs Real Madrid  minutes played  goals  assists  shot on target  ,Negativo
My mood can be dependent on Football matches After today Im in a good mood for the rest of the week   RealMadrid  ,Positivo
We are Real Madrid  ChampionsLeague  RealMadrid  ManchesterCityRealMadrid  ,Positivo
Cookies threeplatform ecosystem integrates analytics and AI to benefit users creators and businesses COOKIE    BAYARS  ChampionLeague  deprem  ManchesterCityRealMadrid  ManCity  RealMadrid  Airdrop Real City PARAM  ,Positivo
 RealMadrid advanced to the semifinals of the  ChampionsLeague after beating  Manchester  on penalties at  EtihadStadium on Wednesday  ,Positivo
 RealMadrid progressed to the semifinals of the  ChampionsLeague after a penalty shootout victory over  ManchesterCity  UCL  ,Positivo
No Real Madrid fans will pass without liking this pic  HalaMadrid  RealMadrid  ChampionsLeague  UEFAChampionsLeague  ManchesterCityRealMadrid    Rumored opportunity from acquaintances    ,Negativo
Just being in heaven And we have returned Football heaven The Glorious  RealMadrid through to Semi final of  UCL Victorious in OT over the Citizens of Manchester Love the game The New Classico   HalaMadridyNadaMas  ,Positivo
Real Madrid will face   in the   semifinals UCL     ManCity  UCL  MCIRMA  MCIRMD  Madridistas  RMPlay  RMTV  RealMadrid  RMCity  ,Positivo
GUARDIOLA THISKLOPP THATTHE GOAT  ONE AND ONLY DON CARLO    RESPECTRespectRESPECT GOAT  LEGEND  FOOTBALL  COACHING  CALCIO  REALMADRID  ACMILAN  PARMA  JUVENTUS  CHELSEA  ITALY  ,Positivo
EURO STARS Man City  Real Madrid  AGG   pens Bellingham amp Co stun holders with dramatic shootout victory at Etihad  RealMadrid  RealMadridManchesterCity        ,Positivo
Exclusive video from Ederson and Belinghams vacation  ederson  bellingham  realmadrid  mancity  ,Positivo
The Don  RealMadrid  NEXT  ,Positivo
And now we rest and watch the sun rise on a grateful universe   HalaMadrid  HalaMadridYNadaMas  WhiteAngles   realmadrid  RealMadridCF  ,Positivo
I saw only one team in the semi final baaaaaaaaaaaaaaaaaaaaaaaaah  HalaMadrid  semifinal  RealMadrid  ,Positivo
Through to the semis after a hard fought second leg at EtihadFT Manchester City  Real Madrid CFPenalties  HalaMadrid  RealMadrid  MadridistasPune  PeaMadridistaDePune  RealPunekar  RMPune  Comonotevoyaquerer  HastAElFinalVamosReal  globalmadridista  RMUCL  Aporla  ,Positivo
 RealMadrid once again proves that the   is in its DNAMeanwhile everyone notices one thing it would be an even stronger team with another great strikerAs mentioned and confirmed its just a matter of time  Mbapp will be a new player for    Just a matter of time Mission complete ,Positivo
Can Real Madrid go and win the Champions League this season RealMadrid  UCL  Football  ,Positivo
We take the half cashMan City with the push Phillies with the easy win  L MLP uGiveaway  coming tomorrow GamblingX  ManchesterCityRealMadrid  ManCity  RealMadrid  ChampionLeague  UCL  CL  Phillies  MCIRMA  NBA  NBAPlayoffs,Positivo
Whoever ask you whats Football just tell them  RealMadrid,Positivo
HALA MADRID WE WON  HalaMadrid  RealMadrid,Positivo
Rudiger scores Our  UCL journey comes to an end     ManCity   UCL,Negativo
So the beard Hass to go for a bit  beard  clean  fit  fitness  bodypositivity  love  happy  mentalhealth  bodybuilding  workout  AskMikha  BAYARS  ManCity    confidence  ,Positivo
Someone please wake me up from this nightmare  How could this happen  ManchesterCity  ManCityvsRealMadrid  UCL  ChampionsLeague  ManCity  ,Negativo
